<?xml version="1.0" encoding="ISO-8859-1"?>
<Fieldml version="0.3_alpha" xsi:noNamespaceSchemaLocation="Fieldml_0.3.xsd" xmlns:xsi="http://www.w3.org/2001/XMLSchema-instance">
 <Region name="library">
  <ContinuousType name="real.1d"/>
  <AbstractEvaluator name="real.1d.variable" valueType="real.1d"/>
  
  <ContinuousType name="real.2d">
    <Components name="real.2d.component" count="2"/>
  </ContinuousType>
  <AbstractEvaluator name="real.2d.component.variable" valueType="real.2d.component"/>
  <AbstractEvaluator name="real.2d.variable" valueType="real.2d"/>

  <ContinuousType name="real.3d">
    <Components name="real.3d.component" count="3"/>
  </ContinuousType>
  <AbstractEvaluator name="real.3d.component.variable" valueType="real.3d.component"/>
  <AbstractEvaluator name="real.3d.variable" valueType="real.3d"/>

  <ContinuousType name="chart.1d">
    <Components name="chart.1d.component" count="1"/>
  </ContinuousType>
  <AbstractEvaluator name="chart.1d.component.variable" valueType="chart.1d.component"/>
  <AbstractEvaluator name="chart.1d.variable" valueType="chart.1d"/>

  <ContinuousType name="chart.2d">
    <Components name="chart.2d.component" count="2"/>
  </ContinuousType>
  <AbstractEvaluator name="chart.2d.component.variable" valueType="chart.2d.component"/>
  <AbstractEvaluator name="chart.2d.variable" valueType="chart.2d"/>

  <ContinuousType name="chart.3d">
    <Components name="chart.3d.component" count="3"/>
  </ContinuousType>
  <AbstractEvaluator name="chart.3d.component.variable" valueType="chart.3d.component"/>
  <AbstractEvaluator name="chart.3d.variable" valueType="chart.3d"/>

  <EnsembleType name="localNodes.1d.line2">
   <Members>
    <MemberRange min="1" max="2"/>
   </Members>
  </EnsembleType>
  <AbstractEvaluator name="localNodes.1d.line2.variable" valueType="localNodes.1d.line2"/>

  <ContinuousType name="parameters.1d.linearLagrange">
    <Components name="parameters.1d.linearLagrange.component" count="2"/>
  </ContinuousType>
  <AbstractEvaluator name="parameters.1d.linearLagrange.component.variable" valueType="parameters.1d.linearLagrange.component"/>
  <AbstractEvaluator name="parameters.1d.linearLagrange.variable" valueType="parameters.1d.linearLagrange"/>

  <ExternalEvaluator name="interpolator.1d.unit.linearLagrange" valueType="real.1d">
    <Variables>
      <Variable name="chart.1d.variable"/>
      <Variable name="parameters.1d.linearLagrange.variable"/>
    </Variables>
  </ExternalEvaluator>

  <EnsembleType name="localNodes.1d.line3">
   <Members>
    <MemberRange min="1" max="3"/>
   </Members>
  </EnsembleType>
  <AbstractEvaluator name="localNodes.1d.line3.variable" valueType="localNodes.1d.line3"/>
  
  <ContinuousType name="parameters.1d.quadraticLagrange">
    <Components name="parameters.1d.quadraticLagrange.component" count="3"/>
  </ContinuousType>
  <AbstractEvaluator name="parameters.1d.quadraticLagrange.component.variable" valueType="parameters.1d.quadraticLagrange.component"/>
  <AbstractEvaluator name="parameters.1d.quadraticLagrange.variable" valueType="parameters.1d.quadraticLagrange"/>

  <ExternalEvaluator name="interpolator.1d.unit.quadraticLagrange" valueType="real.1d">
    <Variables>
      <Variable name="chart.1d.variable"/>
      <Variable name="parameters.1d.quadraticLagrange.variable"/>
    </Variables>
  </ExternalEvaluator>

  <EnsembleType name="localNodes.2d.square2x2">
   <Members>
    <MemberRange min="1" max="4"/>
   </Members>
  </EnsembleType>
  <AbstractEvaluator name="localNodes.2d.square2x2.variable" valueType="localNodes.2d.square2x2"/>

  <ContinuousType name="parameters.2d.bilinearLagrange">
    <Components name="parameters.2d.bilinearLagrange.component" count="4"/>
  </ContinuousType>
  <AbstractEvaluator name="parameters.2d.bilinearLagrange.variable" valueType="parameters.2d.bilinearLagrange"/>
  <AbstractEvaluator name="parameters.2d.bilinearLagrange.component.variable" valueType="parameters.2d.bilinearLagrange.component"/>

  <ExternalEvaluator name="interpolator.2d.unit.bilinearLagrange" valueType="real.1d">
    <Variables>
      <Variable name="chart.2d.variable"/>
      <Variable name="parameters.2d.bilinearLagrange.variable"/>
    </Variables>
  </ExternalEvaluator>

  <EnsembleType name="localNodes.2d.square3x3">
   <Members>
    <MemberRange min="1" max="9"/>
   </Members>
  </EnsembleType>
  <AbstractEvaluator name="localNodes.2d.square3x3.variable" valueType="localNodes.2d.square3x3"/>
  
  <ContinuousType name="parameters.2d.biquadraticLagrange">
    <Components name="parameters.2d.biquadraticLagrange.component" count="9"/>
  </ContinuousType>
  <AbstractEvaluator name="parameters.2d.biquadraticLagrange.variable" valueType="parameters.2d.biquadraticLagrange"/>
  <AbstractEvaluator name="parameters.2d.biquadraticLagrange.component.variable" valueType="parameters.2d.biquadraticLagrange.component"/>

  <ExternalEvaluator name="interpolator.2d.unit.biquadraticLagrange" valueType="real.1d">
    <Variables>
      <Variable name="chart.2d.variable"/>
      <Variable name="parameters.2d.biquadraticLagrange.variable"/>
    </Variables>
  </ExternalEvaluator>

  <EnsembleType name="localNodes.3d.cube2x2x2">
   <Members>
    <MemberRange min="1" max="8"/>
   </Members>
  </EnsembleType>
  <AbstractEvaluator name="localNodes.3d.cube2x2x2.variable" valueType="localNodes.3d.cube2x2x2"/>

  <ContinuousType name="parameters.3d.trilinearLagrange">
    <Components name="parameters.3d.trilinearLagrange.component" count="8"/>
  </ContinuousType>
  <AbstractEvaluator name="parameters.3d.trilinearLagrange.variable" valueType="parameters.3d.trilinearLagrange"/>

  <ExternalEvaluator name="interpolator.3d.unit.trilinearLagrange" valueType="real.1d">
    <Variables>
      <Variable name="chart.3d.variable"/>
      <Variable name="parameters.3d.trilinearLagrange.variable"/>
    </Variables>
  </ExternalEvaluator>

  <EnsembleType name="localNodes.3d.cube3x3x3">
   <Members>
    <MemberRange min="1" max="27"/>
   </Members>
  </EnsembleType>
  <AbstractEvaluator name="localNodes.3d.cube3x3x3.variable" valueType="localNodes.3d.cube3x3x3"/>
  
  <ContinuousType name="parameters.3d.triquadraticLagrange">
    <Components name="parameters.3d.triquadraticLagrange.component" count="27"/>
  </ContinuousType>
  <AbstractEvaluator name="parameters.3d.triquadraticLagrange.variable" valueType="parameters.3d.triquadraticLagrange"/>
  <AbstractEvaluator name="parameters.3d.triquadraticLagrange.component.variable" valueType="parameters.3d.triquadraticLagrange.component"/>

  <ExternalEvaluator name="interpolator.3d.unit.triquadraticLagrange" valueType="real.1d">
    <Variables>
      <Variable name="chart.3d.variable"/>
      <Variable name="parameters.3d.triquadraticLagrange.variable"/>
    </Variables>
  </ExternalEvaluator>

  <ContinuousType name="coordinates.rc.1d"/>
  <AbstractEvaluator name="coordinates.rc.1d.variable" valueType="coordinates.rc.1d"/>

  <ContinuousType name="coordinates.rc.2d">
    <Components name="coordinates.rc.2d.component" count="2"/>
  </ContinuousType>
  <AbstractEvaluator name="coordinates.rc.2d.variable" valueType="coordinates.rc.2d"/>
  <AbstractEvaluator name="coordinates.rc.2d.component.variable" valueType="coordinates.rc.2d.component"/>

  <ContinuousType name="coordinates.rc.3d">
    <Components name="coordinates.rc.3d.component" count="3"/>
  </ContinuousType>
  <AbstractEvaluator name="coordinates.rc.3d.variable" valueType="coordinates.rc.3d"/>
  <AbstractEvaluator name="coordinates.rc.3d.component.variable" valueType="coordinates.rc.3d.component"/>

  <ContinuousType name="parameters.1d.cubicHermite">
    <Components name="parameters.1d.cubicHermite.component" count="4"/>
  </ContinuousType>
  <AbstractEvaluator name="parameters.1d.cubicHermite.variable" valueType="parameters.1d.cubicHermite"/>
  <AbstractEvaluator name="parameters.1d.cubicHermite.component.variable" valueType="parameters.1d.cubicHermite.component"/>
  <AbstractEvaluator name="parameters.1d.cubicHermiteScaling.variable" valueType="parameters.1d.cubicHermite"/>

  <ExternalEvaluator name="interpolator.1d.unit.cubicHermite" valueType="real.1d">
    <Variables>
      <Variable name="chart.1d.variable"/>
      <Variable name="parameters.1d.cubicHermite.variable"/>
    </Variables>
  </ExternalEvaluator>

  <ExternalEvaluator name="interpolator.1d.unit.cubicHermiteScaled" valueType="real.1d">
    <Variables>
      <Variable name="chart.1d.variable"/>
      <Variable name="parameters.1d.cubicHermite.variable"/>
      <Variable name="parameters.1d.cubicHermiteScaling.variable"/>
    </Variables>
  </ExternalEvaluator>

  <ContinuousType name="parameters.2d.bicubicHermite">
    <Components name="parameters.2d.bicubicHermite.component" count="16"/>
  </ContinuousType>
  <AbstractEvaluator name="parameters.2d.bicubicHermite.variable" valueType="parameters.2d.bicubicHermite"/>
  <AbstractEvaluator name="parameters.2d.bicubicHermite.component.variable" valueType="parameters.2d.bicubicHermite.component"/>
  <AbstractEvaluator name="parameters.2d.bicubicHermiteScaling.variable" valueType="parameters.2d.bicubicHermite"/>

  <ExternalEvaluator name="interpolator.2d.unit.bicubicHermite" valueType="real.1d">
    <Variables>
      <Variable name="chart.2d.variable"/>
      <Variable name="parameters.2d.bicubicHermite.variable"/>
    </Variables>
  </ExternalEvaluator>

  <ExternalEvaluator name="interpolator.2d.unit.bicubicHermiteScaled" valueType="real.1d">
    <Variables>
      <Variable name="chart.2d.variable"/>
      <Variable name="parameters.2d.bicubicHermite.variable"/>
      <Variable name="parameters.2d.bicubicHermiteScaling.variable"/>
    </Variables>
  </ExternalEvaluator>

  <ContinuousType name="parameters.3d.tricubicHermite">